{
  "schemaVersion": "1.0.0",
  "kind": "componentDefinition",
  "componentDefinitionId": 2,
  "name": "Reinforced Hilt",
  "category": 2,
  "rarityTier": 1,
  "techTier": 1,
  "enabled": true,
  "metadataRevision": 1,
  "verificationStatus": "confirmed",
  "notes": "Synced from live CityComponents."
}
