{
  "schemaVersion": "1.0.0",
  "kind": "componentDefinition",
  "componentDefinitionId": 3,
  "name": "Crystal Core",
  "category": 3,
  "rarityTier": 2,
  "techTier": 2,
  "enabled": true,
  "metadataRevision": 1,
  "verificationStatus": "confirmed",
  "notes": "Synced from live CityComponents."
}
